{
  "schema_version": "0.1",
  "producer": "team4",
  "timestamp": "2026-10-25T10:01:05.060Z",
  "seq": 8,
  "frame_id": "robot_base",
  "valid": true,
  "trajectory_id": "traj_001",
  "trajectory_revision": 1,
  "joint_id": "candidate_001",
  "measurement": {
    "planned_position_m": [0.45, 0.02, 0.22],
    "observed_position_m": [0.45, 0.0205, 0.2198],
    "deviation_m": [0.0, 0.0005, -0.0002]
  },
  "filtered_offset_m": [0.0, 0.0004, -0.0001],
  "proposed_absolute_offset_m": [0.0, 0.0004, -0.0001],
  "within_limits": true,
  "action_requested": "CORRECT_WITH_REVALIDATION",
  "speed_proposal_m_s": null,
  "confidence": 0.89,
  "reason": "bounded measurement-based proposal; validate through Team 6",
  "limits_profile": "SIMULATION_ASSUMPTIONS_ONLY"
}
